Cluster,Domenii,Logo-uri
Grup 77, toyotanatas.com.tr, toyotafocsani.ro, toyotaaktoy.com.tr, toyotagocmenturk.com.tr, toyotabacau.ro, toyotasandikci.com.tr, toyotakar.com.tr, toyotabakircilarfethiye.com.tr, toyotacavdarli.com.tr, toyotasarar.com.tr, toyotaakkoyunlu.com.tr, toyotaotojen.com.tr, toyotaconstanta.ro, toyotagoktepe.com.tr, toyotabucurestinord.ro, toyotamezcar.com.tr, toyotatokullar.com.tr, toyotamici.com.tr, toyotaelpa.com.tr, toyotasamlioglu.com.tr, toyotayoruk.com.tr, toyotaefe.com.tr, toyotayatumugla.com.tr, toyotasud.ro, toyotaparmaksizlar.com.tr, toyotatoyan.com.tr, toyotahizel.com.tr, toyotaploiesti.ro, toyotaboranlar.com.tr, toyotakuzen.com.tr, toyotaoztoprakhatay.com.tr, toyotayigitvar.com.tr, toyotacetas.com.tr, toyotaaydogan.com.tr, toyotaderinderekocak.com.tr, toyotaaykon.com.tr, toyotayatubodrum.com.tr, toyotaborovali.com.tr, toyotaakten.com.tr, toyotaer.com.tr, toyotaonatca.com.tr, toyotasonkar.com.tr, toyotakocaelikaya.com.tr, logos/toyotanatas.com.tr.png, logos/toyotafocsani.ro.png, logos/toyotaaktoy.com.tr.png, logos/toyotagocmenturk.com.tr.png, logos/toyotabacau.ro.png, logos/toyotasandikci.com.tr.png, logos/toyotakar.com.tr.png, logos/toyotabakircilarfethiye.com.tr.png, logos/toyotacavdarli.com.tr.png, logos/toyotasarar.com.tr.png, logos/toyotaakkoyunlu.com.tr.png, logos/toyotaotojen.com.tr.png, logos/toyotaconstanta.ro.png, logos/toyotagoktepe.com.tr.png, logos/toyotabucurestinord.ro.png, logos/toyotamezcar.com.tr.png, logos/toyotatokullar.com.tr.png, logos/toyotamici.com.tr.png, logos/toyotaelpa.com.tr.png, logos/toyotasamlioglu.com.tr.png, logos/toyotayoruk.com.tr.png, logos/toyotaefe.com.tr.png, logos/toyotayatumugla.com.tr.png, logos/toyotasud.ro.png, logos/toyotaparmaksizlar.com.tr.png, logos/toyotatoyan.com.tr.png, logos/toyotahizel.com.tr.png, logos/toyotaploiesti.ro.png, logos/toyotaboranlar.com.tr.png, logos/toyotakuzen.com.tr.png, logos/toyotaoztoprakhatay.com.tr.png, logos/toyotayigitvar.com.tr.png, logos/toyotacetas.com.tr.png, logos/toyotaaydogan.com.tr.png, logos/toyotaderinderekocak.com.tr.png, logos/toyotaaykon.com.tr.png, logos/toyotayatubodrum.com.tr.png, logos/toyotaborovali.com.tr.png, logos/toyotaakten.com.tr.png, logos/toyotaer.com.tr.png, logos/toyotaonatca.com.tr.png, logos/toyotasonkar.com.tr.png, logos/toyotakocaelikaya.com.tr.png
Grup 78, mazda.de, mazda.hu, mazda.si, mazda.nl, mazda.es, mazda.com.tr, logos/mazda.de.png, logos/mazda.hu.png, logos/mazda.si.png, logos/mazda.nl.png, logos/mazda.es.png, logos/mazda.com.tr.png
Grup 79, crocs.co.id, logos/crocs.co.id.png
Grup 80, bbraun.rs, bbraun.ca, bbraun.ph, bbraun.lt, bbraun.com.vn, bbraun.se, bbraun.co, bbraun.pt, bbraun.ru, bbraun.lv, bbraun.hr, bbraun.co.kr, bbraun.dk, bbraun.co.in, bbraun-vetcare.nl, bbraun.com.tr, bbraun.hu, bbraun.com.br, bbraun.bg, bbraun.pk, bbraun.com.tw, bbraun.mx, bbraun.ro, bbraun.no, bbraun.fi, bbraun.cz, bbraun-vetcare.pt, bbraun.co.th, bbraun.co.za, logos/bbraun.rs.png, logos/bbraun.ca.png, logos/bbraun.ph.png, logos/bbraun.lt.png, logos/bbraun.com.vn.png, logos/bbraun.se.png, logos/bbraun.co.png, logos/bbraun.pt.png, logos/bbraun.ru.png, logos/bbraun.lv.png, logos/bbraun.hr.png, logos/bbraun.co.kr.png, logos/bbraun.dk.png, logos/bbraun.co.in.png, logos/bbraun-vetcare.nl.png, logos/bbraun.com.tr.png, logos/bbraun.hu.png, logos/bbraun.com.br.png, logos/bbraun.bg.png, logos/bbraun.pk.png, logos/bbraun.com.tw.png, logos/bbraun.mx.png, logos/bbraun.ro.png, logos/bbraun.no.png, logos/bbraun.fi.png, logos/bbraun.cz.png, logos/bbraun-vetcare.pt.png, logos/bbraun.co.th.png, logos/bbraun.co.za.png
Grup 81, daikin.com.sg, daikin-china.com.cn, dertour.sk, daikinmalaysia.com, dci.co.th, dmcihomes.jp, daikinchemicals.co.th, desjoyauxcreuse.com, dhirajsonsonline.com, logos/daikin.com.sg.png, logos/daikin-china.com.cn.png, logos/dertour.sk.png, logos/daikinmalaysia.com.png, logos/dci.co.th.png, logos/dmcihomes.jp.png, logos/daikinchemicals.co.th.png, logos/desjoyauxcreuse.com.png, logos/dhirajsonsonline.com.png
Grup 82, spitex-regionbirs.ch, spitex-wiggertal.ch, spitexgossau.ch, spitex-oberthurgau.ch, spitexzug.ch, spitex-oberfreiamt.ch, spitex-imboden.ch, spitex-waedenswil.ch, spitexmuri.ch, spitex.sg, spitex-wuerenlos.ch, spitexow.ch, spitex-linth.ch, spitex-emmen.ch, spitex-rotbachtal.ch, spitex-zimmerberg.ch, spitexrontalplus.ch, spitexniesen.ch, spitex-regiowittenbach.ch, spitex-grauholz.ch, spitexkempt.ch, spitextg.ch, spitexzh.ch, spitexkaiseraugst.ch, spitex-romanshorn.ch, spitex-bodensee.ch, spitex-gaeu.ch, spitex-wyland.ch, logos/spitex-regionbirs.ch.png, logos/spitex-wiggertal.ch.png, logos/spitexgossau.ch.png, logos/spitex-oberthurgau.ch.png, logos/spitexzug.ch.png, logos/spitex-oberfreiamt.ch.png, logos/spitex-imboden.ch.png, logos/spitex-waedenswil.ch.png, logos/spitexmuri.ch.png, logos/spitex.sg.png, logos/spitex-wuerenlos.ch.png, logos/spitexow.ch.png, logos/spitex-linth.ch.png, logos/spitex-emmen.ch.png, logos/spitex-rotbachtal.ch.png, logos/spitex-zimmerberg.ch.png, logos/spitexrontalplus.ch.png, logos/spitexniesen.ch.png, logos/spitex-regiowittenbach.ch.png, logos/spitex-grauholz.ch.png, logos/spitexkempt.ch.png, logos/spitextg.ch.png, logos/spitexzh.ch.png, logos/spitexkaiseraugst.ch.png, logos/spitex-romanshorn.ch.png, logos/spitex-bodensee.ch.png, logos/spitex-gaeu.ch.png, logos/spitex-wyland.ch.png
Grup 83, einhell.ba, einhell.hr, einhell.com.ar, einhell.ch, einhell.com.gr, einhell.de, einhell.com.tr, einhell.co.uk, einhell.pl, einhell.cz, einhell.bg, einhell.dk, einhell.nl, einhell.rs, einhell.fi, logos/einhell.ba.png, logos/einhell.hr.png, logos/einhell.com.ar.png, logos/einhell.ch.png, logos/einhell.com.gr.png, logos/einhell.de.png, logos/einhell.com.tr.png, logos/einhell.co.uk.png, logos/einhell.pl.png, logos/einhell.cz.png, logos/einhell.bg.png, logos/einhell.dk.png, logos/einhell.nl.png, logos/einhell.rs.png, logos/einhell.fi.png
Grup 84, linexofschererville.com, linexofwilliston.com, linexswfl.com, linexofchickasha.com, linexofstlouismo.com, linexofjoliet.com, logos/linexofschererville.com.png, logos/linexofwilliston.com.png, logos/linexswfl.com.png, logos/linexofchickasha.com.png, logos/linexofstlouismo.com.png, logos/linexofjoliet.com.png
Grup 85, webster.nl, logos/webster.nl.png
Grup 86, flashbay.ca, flashbay.com.my, flashbay.co.nz, flashbay.fr, flashbay.no, flashbay.hu, flashbay.pt, flashbay.fi, flashbay.es, logos/flashbay.ca.png, logos/flashbay.com.my.png, logos/flashbay.co.nz.png, logos/flashbay.fr.png, logos/flashbay.no.png, logos/flashbay.hu.png, logos/flashbay.pt.png, logos/flashbay.fi.png, logos/flashbay.es.png
Grup 87, pingusenglish.com.tr, pingusenglish.co.id, pingusenglishbd.com, pingusenglish.com.cy, pingusenglish.my, pingusenglish.com, pingusenglish.ee, pingusenglish.vn, logos/pingusenglish.com.tr.png, logos/pingusenglish.co.id.png, logos/pingusenglishbd.com.png, logos/pingusenglish.com.cy.png, logos/pingusenglish.my.png, logos/pingusenglish.com.png, logos/pingusenglish.ee.png, logos/pingusenglish.vn.png
Grup 88, compo.de, compo.pl, compo-hobby.it, compo-group.com, compo.es, logos/compo.de.png, logos/compo.pl.png, logos/compo-hobby.it.png, logos/compo-group.com.png, logos/compo.es.png
Grup 89, pkf-hk.com, pkflesotho.com, pkf.dk, pkfcr.co.nz, pkfcaribbean.com, pkf.swiss, pkf-dominicana.com, pkfcemac.com, pkfboi.nz, pkf.co.uk, pkfsingapore.com, logos/pkf-hk.com.png, logos/pkflesotho.com.png, logos/pkf.dk.png, logos/pkfcr.co.nz.png, logos/pkfcaribbean.com.png, logos/pkf.swiss.png, logos/pkf-dominicana.com.png, logos/pkfcemac.com.png, logos/pkfboi.nz.png, logos/pkf.co.uk.png, logos/pkfsingapore.com.png
Grup 90, besins-healthcare.se, besins-healthcare.nl, besins-healthcare.com.mx, logos/besins-healthcare.se.png, logos/besins-healthcare.nl.png, logos/besins-healthcare.com.mx.png
Grup 91, subaru.jp, subaru-bd.com, logos/subaru.jp.png, logos/subaru-bd.com.png
Grup 92, renaultmerida.com.mx, renaultsancosme.com.mx, renaulttlalnepantla.com.mx, renaultcampeche.mx, renaultchiapas.com.mx, renaultcancun.com.mx, renaultinterlomas.com, renaultcoatzacoalcos.com.mx, renaultamericas.com.mx, renaultpuertovallarta.com.mx, renaultmonterrey.com, renault-chihuahua.com, renaultpatriotismo.com.mx, renaultpatria.com.mx, renaultdelsol.com.mx, logos/renaultmerida.com.mx.png, logos/renaultsancosme.com.mx.png, logos/renaulttlalnepantla.com.mx.png, logos/renaultcampeche.mx.png, logos/renaultchiapas.com.mx.png, logos/renaultcancun.com.mx.png, logos/renaultinterlomas.com.png, logos/renaultcoatzacoalcos.com.mx.png, logos/renaultamericas.com.mx.png, logos/renaultpuertovallarta.com.mx.png, logos/renaultmonterrey.com.png, logos/renault-chihuahua.com.png, logos/renaultpatriotismo.com.mx.png, logos/renaultpatria.com.mx.png, logos/renaultdelsol.com.mx.png
Grup 93, cvjm-pfalz.de, cvjm-augsburg.de, logos/cvjm-pfalz.de.png, logos/cvjm-augsburg.de.png
Grup 94, medef-alsace.com, medef-artois.fr, medef-bearnetsoule.com, medef-corse.com, medef-sarthe.fr, medef-ain.fr, medef-essonne.org, medef-beziers.fr, medef-aude.com, medef-vendee.fr, medef79.fr, medef-paysdelaloire.fr, medef-nouvelle-aquitaine.fr, medef-anjou.fr, medefloire.fr, medef41.fr, medef71.com, medef-mayenne.com, medef-ardennes.com, medef-44.fr, medef-franche-comte.com, medef-cher.fr, medef-pays-basque.fr, medef-cote-opale.com, medef31.fr, medef-dromeardeche.fr, medef-seine-estuaire.fr, medef-htcis.com, medeforne.fr, medef-seineetmarne.fr, medef-aura.fr, logos/medef-alsace.com.png, logos/medef-artois.fr.png, logos/medef-bearnetsoule.com.png, logos/medef-corse.com.png, logos/medef-sarthe.fr.png, logos/medef-ain.fr.png, logos/medef-essonne.org.png, logos/medef-beziers.fr.png, logos/medef-aude.com.png, logos/medef-vendee.fr.png, logos/medef79.fr.png, logos/medef-paysdelaloire.fr.png, logos/medef-nouvelle-aquitaine.fr.png, logos/medef-anjou.fr.png, logos/medefloire.fr.png, logos/medef41.fr.png, logos/medef71.com.png, logos/medef-mayenne.com.png, logos/medef-ardennes.com.png, logos/medef-44.fr.png, logos/medef-franche-comte.com.png, logos/medef-cher.fr.png, logos/medef-pays-basque.fr.png, logos/medef-cote-opale.com.png, logos/medef31.fr.png, logos/medef-dromeardeche.fr.png, logos/medef-seine-estuaire.fr.png, logos/medef-htcis.com.png, logos/medeforne.fr.png, logos/medef-seineetmarne.fr.png, logos/medef-aura.fr.png
Grup 95, tbwa.co.za, logos/tbwa.co.za.png
Grup 96, engie.pt, logos/engie.pt.png
Grup 97, subaru.nc, subaru.com.tr, logos/subaru.nc.png, logos/subaru.com.tr.png
Grup 98, peugeot.sk, logos/peugeot.sk.png
Grup 99, siebtechnik-tema.cn, siebtechnik-tema.co.uk, siebtechnik-tema.nl, siebtechnik-tema.com.au, logos/siebtechnik-tema.cn.png, logos/siebtechnik-tema.co.uk.png, logos/siebtechnik-tema.nl.png, logos/siebtechnik-tema.com.au.png
Grup 100, santillana.com.hn, santillana.com.uy, santillana.com.sv, santillana.com.co, santillana.com.ar, santillana.com.ec, santillana.com.pa, logos/santillana.com.hn.png, logos/santillana.com.uy.png, logos/santillana.com.sv.png, logos/santillana.com.co.png, logos/santillana.com.ar.png, logos/santillana.com.ec.png, logos/santillana.com.pa.png
Grup 101, intersport-rent.fr, intersport.si, intersport-courchevel1850.com, intersport-grandbornand.com, intersport-arvieux.com, intersport-risoul.com, intersport.ch, intersport-courchevel1550.com, intersport.nl, intersport-arc2000.com, intersport-lesrousses.com, logos/intersport-rent.fr.png, logos/intersport.si.png, logos/intersport-courchevel1850.com.png, logos/intersport-grandbornand.com.png, logos/intersport-arvieux.com.png, logos/intersport-risoul.com.png, logos/intersport.ch.png, logos/intersport-courchevel1550.com.png, logos/intersport.nl.png, logos/intersport-arc2000.com.png, logos/intersport-lesrousses.com.png
Grup 102, mazdabali.co.id, logos/mazdabali.co.id.png
Grup 103, strabag-pfs.com, logos/strabag-pfs.com.png
Grup 104, meggle-bakery.com, meggle-cheese.com, meggle-group.com, logos/meggle-bakery.com.png, logos/meggle-cheese.com.png, logos/meggle-group.com.png
Grup 105, nutriciababy.be, nutriciavoorjou.nl, logos/nutriciababy.be.png, logos/nutriciavoorjou.nl.png
Grup 106, pcllawyersfrankston.com.au, logos/pcllawyersfrankston.com.au.png
Grup 107, adra.org.pe, adra.pl, adra.ca, adra.se, logos/adra.org.pe.png, logos/adra.pl.png, logos/adra.ca.png, logos/adra.se.png
Grup 108, inductotherm.co.kr, inductothermgroup.com.br, inductotherm.ca, inductothermhw.com, inductothermgroup.jp, inductotherm.com.tr, inductotherm.com.cn, inductotherm.com.au, inductotherm-group-france.fr, logos/inductotherm.co.kr.png, logos/inductothermgroup.com.br.png, logos/inductotherm.ca.png, logos/inductothermhw.com.png, logos/inductothermgroup.jp.png, logos/inductotherm.com.tr.png, logos/inductotherm.com.cn.png, logos/inductotherm.com.au.png, logos/inductotherm-group-france.fr.png
Grup 109, renault.dk, logos/renault.dk.png
Grup 110, wurth.com.uy, wurth.ua, wurth.lk, wurth.com.vn, wurth.hu, wurth.ae, wuerth.com.ph, wurth.co.nz, wurth.co.uk, wurth.lv, wurth.cl, wurth.co.za, wurth.pt, wurth.sk, logos/wurth.com.uy.png, logos/wurth.ua.png, logos/wurth.lk.png, logos/wurth.com.vn.png, logos/wurth.hu.png, logos/wurth.ae.png, logos/wuerth.com.ph.png, logos/wurth.co.nz.png, logos/wurth.co.uk.png, logos/wurth.lv.png, logos/wurth.cl.png, logos/wurth.co.za.png, logos/wurth.pt.png, logos/wurth.sk.png
Grup 111, culliganwi.com, culliganheartland.com, culligantotalwater.com, culliganquadcities.com, culliganwatertreatment.com, culligantulsa.com, rockvalleyculligan.com, culligansiouxcity.com, culligandelavan.com, culliganmichigan.com, culliganwatercorrections.com, culliganchampaign.com, culliganregina.com, culliganwt.com, culliganmidmichigan.com, culligansouthwest.com, culliganromeo.com, culliganlacrosse.com, culliganmarlette.com, culliganwaterbillings.com, culliganbrighton.com, culliganricelake.com, culliganmarion.com, culligancountry.com, culliganiowa.com, culliganofnashville.com, culliganporthuron.com, allthingswater.com, culligantucson.com, culliganphoenix.com, culliganillinoisvalley.com, culliganalbionhillsdale.com, culliganofidaho.com, culligannc.com, culliganfresnolindsay.com, culligantotalwateriowa.com, culliganwaterwyoming.com, culliganillinois.com, culligankennewick.com, culliganmoseslake.com, culliganbetterwater.com, culliganofpeoria.com, culligantotalwaterbaraboo.com, culligangrandisland.com, culliganuppercumberland.com, culliganwheaton.com, culliganwaterstillwater.com, culliganofmerrillville.com, culliganindiana.com, culliganminneapolis.com, vettersculliganwater.com, culliganchicago.com, culliganwaterburlington.com, culliganatlanta.com, culliganflint.com, culliganofofallon.com, culliganlasvegas.com, culligancentralindiana.com, culliganhoriconwatertown.com, culliganwaterwestbend.com, culligantoledo.com, culliganwaternebraska.com, culliganwatercolorado.com, culligannation.com, culligandenkerwaterconditioning.com, culliganh2o.com, culliganjanesville.com, culliganwooster.com, culliganadvantage.com, culliganofwestbranch.com, culliganstlouis.com, culliganslc.com, culliganofsouthwestwisconsin.com, culliganwisconsin.com, culliganlemars.com, culligansanantonio.com, culliganmonroe.com, culligangrandrapids.com, culliganlansing.com, drinkculligan.com, culliganallegan.com, logos/culliganwi.com.png, logos/culliganheartland.com.png, logos/culligantotalwater.com.png, logos/culliganquadcities.com.png, logos/culliganwatertreatment.com.png, logos/culligantulsa.com.png, logos/rockvalleyculligan.com.png, logos/culligansiouxcity.com.png, logos/culligandelavan.com.png, logos/culliganmichigan.com.png, logos/culliganwatercorrections.com.png, logos/culliganchampaign.com.png, logos/culliganregina.com.png, logos/culliganwt.com.png, logos/culliganmidmichigan.com.png, logos/culligansouthwest.com.png, logos/culliganromeo.com.png, logos/culliganlacrosse.com.png, logos/culliganmarlette.com.png, logos/culliganwaterbillings.com.png, logos/culliganbrighton.com.png, logos/culliganricelake.com.png, logos/culliganmarion.com.png, logos/culligancountry.com.png, logos/culliganiowa.com.png, logos/culliganofnashville.com.png, logos/culliganporthuron.com.png, logos/allthingswater.com.png, logos/culligantucson.com.png, logos/culliganphoenix.com.png, logos/culliganillinoisvalley.com.png, logos/culliganalbionhillsdale.com.png, logos/culliganofidaho.com.png, logos/culligannc.com.png, logos/culliganfresnolindsay.com.png, logos/culligantotalwateriowa.com.png, logos/culliganwaterwyoming.com.png, logos/culliganillinois.com.png, logos/culligankennewick.com.png, logos/culliganmoseslake.com.png, logos/culliganbetterwater.com.png, logos/culliganofpeoria.com.png, logos/culligantotalwaterbaraboo.com.png, logos/culligangrandisland.com.png, logos/culliganuppercumberland.com.png, logos/culliganwheaton.com.png, logos/culliganwaterstillwater.com.png, logos/culliganofmerrillville.com.png, logos/culliganindiana.com.png, logos/culliganminneapolis.com.png, logos/vettersculliganwater.com.png, logos/culliganchicago.com.png, logos/culliganwaterburlington.com.png, logos/culliganatlanta.com.png, logos/culliganflint.com.png, logos/culliganofofallon.com.png, logos/culliganlasvegas.com.png, logos/culligancentralindiana.com.png, logos/culliganhoriconwatertown.com.png, logos/culliganwaterwestbend.com.png, logos/culligantoledo.com.png, logos/culliganwaternebraska.com.png, logos/culliganwatercolorado.com.png, logos/culligannation.com.png, logos/culligandenkerwaterconditioning.com.png, logos/culliganh2o.com.png, logos/culliganjanesville.com.png, logos/culliganwooster.com.png, logos/culliganadvantage.com.png, logos/culliganofwestbranch.com.png, logos/culliganstlouis.com.png, logos/culliganslc.com.png, logos/culliganofsouthwestwisconsin.com.png, logos/culliganwisconsin.com.png, logos/culliganlemars.com.png, logos/culligansanantonio.com.png, logos/culliganmonroe.com.png, logos/culligangrandrapids.com.png, logos/culliganlansing.com.png, logos/drinkculligan.com.png, logos/culliganallegan.com.png
Grup 112, vitalimages.com, canon-its.co.jp, logos/vitalimages.com.png, logos/canon-its.co.jp.png
Grup 113, amnesty.is, amnesty.id, amnesty.lu, amnesty.eu, amnesty.org.ng, amnestyghana.org, logos/amnesty.is.png, logos/amnesty.id.png, logos/amnesty.lu.png, logos/amnesty.eu.png, logos/amnesty.org.ng.png, logos/amnestyghana.org.png
Grup 114, meggle.co.jp, logos/meggle.co.jp.png
Grup 115, engie.cl, logos/engie.cl.png
Grup 116, linde-finance.com, linde.pe, lindeoilandgas.com, linde-gas.com, linde.bo, linde-amt.com, logos/linde-finance.com.png, logos/linde.pe.png, logos/lindeoilandgas.com.png, logos/linde-gas.com.png, logos/linde.bo.png, logos/linde-amt.com.png
Grup 117, narscosmetics.es, narscosmetics.co.uk, narscosmetics.fr, narscosmetics.de, logos/narscosmetics.es.png, logos/narscosmetics.co.uk.png, logos/narscosmetics.fr.png, logos/narscosmetics.de.png
Grup 118, brother.com.pe, brother.com.br, brother.com.mx, logos/brother.com.pe.png, logos/brother.com.br.png, logos/brother.com.mx.png
Grup 119, ikea.com.hk, ikea.co.id, ikea.com.tw, logos/ikea.com.hk.png, logos/ikea.co.id.png, logos/ikea.com.tw.png
Grup 120, catsprotectionshop.co.uk, logos/catsprotectionshop.co.uk.png
Grup 121, sephora.pl, sephora.dk, sephora.gr, sephora.pt, sephora.ro, sephora.it, sephora.es, sephora.fr, logos/sephora.pl.png, logos/sephora.dk.png, logos/sephora.gr.png, logos/sephora.pt.png, logos/sephora.ro.png, logos/sephora.it.png, logos/sephora.es.png, logos/sephora.fr.png
Grup 122, sherwin-williams.com.ec, logos/sherwin-williams.com.ec.png
Grup 123, ecslupsk.pl, logos/ecslupsk.pl.png
Grup 124, kierpensions.co.uk, logos/kierpensions.co.uk.png
Grup 125, linak.nl, linak.com.br, linak-latinamerica.com, linak.kr, linak.de, linak.cz, linak.es, linak.pl, logos/linak.nl.png, logos/linak.com.br.png, logos/linak-latinamerica.com.png, logos/linak.kr.png, logos/linak.de.png, logos/linak.cz.png, logos/linak.es.png, logos/linak.pl.png
Grup 126, taylorfarmsdeli.com, logos/taylorfarmsdeli.com.png
Grup 127, actemium.ch, actemium.pt, actemium.com, actemium.at, actemium.us, actemium.sk, actemium.de, actemium.it, actemium.es, actemium.co.uk, actemium.com.br, actemium.ca, actemium.se, logos/actemium.ch.png, logos/actemium.pt.png, logos/actemium.com.png, logos/actemium.at.png, logos/actemium.us.png, logos/actemium.sk.png, logos/actemium.de.png, logos/actemium.it.png, logos/actemium.es.png, logos/actemium.co.uk.png, logos/actemium.com.br.png, logos/actemium.ca.png, logos/actemium.se.png
Grup 128, chip.pl, logos/chip.pl.png
Grup 129, grantthornton.com.sv, grantthornton.com.ve, grantthornton.com.pa, grantthornton.az, grantthornton.tn, grantthornton.bg, grantthornton.do, grantthornton.ci, grantthornton.co.im, logos/grantthornton.com.sv.png, logos/grantthornton.com.ve.png, logos/grantthornton.com.pa.png, logos/grantthornton.az.png, logos/grantthornton.tn.png, logos/grantthornton.bg.png, logos/grantthornton.do.png, logos/grantthornton.ci.png, logos/grantthornton.co.im.png
Grup 130, bakertilly.com.pa, bestrucksofmn.net, bakertillymapema.se, brother-industrial.md, bakertillylb.com, brother-industrial.com, boschtools.com, berlitz.com.py, berlitzmanchester.com, bakertillysek.se, budgetqatar.com, bestwesternbraddock.com, brother.com.ar, brother.cn, bbraun.cn, logos/bakertilly.com.pa.png, logos/bestrucksofmn.net.png, logos/bakertillymapema.se.png, logos/brother-industrial.md.png, logos/bakertillylb.com.png, logos/brother-industrial.com.png, logos/boschtools.com.png, logos/berlitz.com.py.png, logos/berlitzmanchester.com.png, logos/bakertillysek.se.png, logos/budgetqatar.com.png, logos/bestwesternbraddock.com.png, logos/brother.com.ar.png, logos/brother.cn.png, logos/bbraun.cn.png
Grup 131, vkf-renzel.com.tr, vkf-renzel.ro, vkf-renzel.cz, vkf-renzel.fr, vkf-renzel.bg, vkf-renzel.nl, vkf-renzel.co.uk, vkf-renzel.dk, vkf-renzel.hu, logos/vkf-renzel.com.tr.png, logos/vkf-renzel.ro.png, logos/vkf-renzel.cz.png, logos/vkf-renzel.fr.png, logos/vkf-renzel.bg.png, logos/vkf-renzel.nl.png, logos/vkf-renzel.co.uk.png, logos/vkf-renzel.dk.png, logos/vkf-renzel.hu.png
Grup 132, fleishmanhillard.cn, fleishmanhillard.ph, fleishmanhillard.co.th, fleishmanhillard.com.br, fleishmanhillard.mx, fleishmanhillard.ie, fleishmanhillard.co.id, fleishmanhillard.cz, logos/fleishmanhillard.cn.png, logos/fleishmanhillard.ph.png, logos/fleishmanhillard.co.th.png, logos/fleishmanhillard.com.br.png, logos/fleishmanhillard.mx.png, logos/fleishmanhillard.ie.png, logos/fleishmanhillard.co.id.png, logos/fleishmanhillard.cz.png
Grup 133, isover.hu, isover.se, isover.ua, isover.com.br, isover.co.kr, isover.at, isover.be, logos/isover.hu.png, logos/isover.se.png, logos/isover.ua.png, logos/isover.com.br.png, logos/isover.co.kr.png, logos/isover.at.png, logos/isover.be.png
Grup 134, renaulttersa.com.mx, renault.no, renault.com.my, renaultselection.co.za, renault.jo, logos/renaulttersa.com.mx.png, logos/renault.no.png, logos/renault.com.my.png, logos/renaultselection.co.za.png, logos/renault.jo.png
Grup 135, zktecoma.com, logos/zktecoma.com.png
Grup 136, azets.ie, logos/azets.ie.png
Grup 137, mooresingapore.com, moore-czech.cz, moorestoke.co.uk, logos/mooresingapore.com.png, logos/moore-czech.cz.png, logos/moorestoke.co.uk.png
Grup 138, urmet.com.br, logos/urmet.com.br.png
Grup 139, toysrus.com.sg, toysrus.com.my, logos/toysrus.com.sg.png, logos/toysrus.com.my.png
Grup 140, manpowergroup.no, manpowergroup.dk, manpowergroup.com.sg, manpowergroup.pt, manpower.co.za, manpowergroup.se, manpowergroup.cz, logos/manpowergroup.no.png, logos/manpowergroup.dk.png, logos/manpowergroup.com.sg.png, logos/manpowergroup.pt.png, logos/manpower.co.za.png, logos/manpowergroup.se.png, logos/manpowergroup.cz.png
Grup 141, mapfre.pr, mapfre.com.ni, mapfre.com.sv, mapfre.com.py, mapfre.com.uy, mapfre.com.ve, mapfre.com.gt, logos/mapfre.pr.png, logos/mapfre.com.ni.png, logos/mapfre.com.sv.png, logos/mapfre.com.py.png, logos/mapfre.com.uy.png, logos/mapfre.com.ve.png, logos/mapfre.com.gt.png
Grup 142, modshair-nuernberg.de, modshair-bielefeld.de, modshair-braunschweig.de, modshair-hannover.de, modshair-koeln-lindenthal.de, modshair-koeln-city.de, logos/modshair-nuernberg.de.png, logos/modshair-bielefeld.de.png, logos/modshair-braunschweig.de.png, logos/modshair-hannover.de.png, logos/modshair-koeln-lindenthal.de.png, logos/modshair-koeln-city.de.png
Grup 143, cdu-aldenhoven.de, logos/cdu-aldenhoven.de.png
Grup 144, axabreakdown.co.uk, axa.com.br, logos/axabreakdown.co.uk.png, logos/axa.com.br.png
Grup 145, crif.pl, crif.cz, crif.hk, crif.ch, crif.sk, crif.com.tr, logos/crif.pl.png, logos/crif.cz.png, logos/crif.hk.png, logos/crif.ch.png, logos/crif.sk.png, logos/crif.com.tr.png
Grup 146, panpuri.fr, logos/panpuri.fr.png
Grup 147, despec.eu, logos/despec.eu.png
Grup 148, savethechildren.mx, logos/savethechildren.mx.png
Grup 149, chicco.pl, chicco.ru, chicco.co.nz, canon.cl, chicco.com.tw, chicco.com.ph, ctdi.in, cfmotoindia.com, chubblifefund.com.vn, logos/chicco.pl.png, logos/chicco.ru.png, logos/chicco.co.nz.png, logos/canon.cl.png, logos/chicco.com.tw.png, logos/chicco.com.ph.png, logos/ctdi.in.png, logos/cfmotoindia.com.png, logos/chubblifefund.com.vn.png
Grup 150, algordanza.com.au, logos/algordanza.com.au.png
