Cluster,Domenii,Logo-uri
Grup 0, stanbicbank.co.zw, stanbicbank.co.bw, soneparfrance.fr, subaru.com.np, shimadzu.in, shimadzu.com.ph, shimadzu-rika.co.jp, savethechildren.nl, sonepar.pt, stanleyelectricus.com, sonepar.com.sg, subaru.mt, starkey.co.kr, selgen.eu, subaruqatar.com, shimadzu-techno.co.jp, sonepar.pe, stanbicbank.co.ke, sonepar.hu, shimadzu.com.cn, shimadzu.co.kr, seiban.com, spitexrl.ch, subaru.com.gt, logos/stanbicbank.co.zw.png, logos/stanbicbank.co.bw.png, logos/soneparfrance.fr.png, logos/subaru.com.np.png, logos/shimadzu.in.png, logos/shimadzu.com.ph.png, logos/shimadzu-rika.co.jp.png, logos/savethechildren.nl.png, logos/sonepar.pt.png, logos/stanleyelectricus.com.png, logos/sonepar.com.sg.png, logos/subaru.mt.png, logos/starkey.co.kr.png, logos/selgen.eu.png, logos/subaruqatar.com.png, logos/shimadzu-techno.co.jp.png, logos/sonepar.pe.png, logos/stanbicbank.co.ke.png, logos/sonepar.hu.png, logos/shimadzu.com.cn.png, logos/shimadzu.co.kr.png, logos/seiban.com.png, logos/spitexrl.ch.png, logos/subaru.com.gt.png
Grup 1, astrazeneca.ua, astrazeneca.hu, astrazeneca.no, astrazeneca.dk, astrazeneca.com.tr, astrazeneca.ca, astrazeneca.pt, astrazeneca.com.hk, logos/astrazeneca.ua.png, logos/astrazeneca.hu.png, logos/astrazeneca.no.png, logos/astrazeneca.dk.png, logos/astrazeneca.com.tr.png, logos/astrazeneca.ca.png, logos/astrazeneca.pt.png, logos/astrazeneca.com.hk.png
Grup 2, autosecuritas-ct-seysses.fr, autosecuritas-barlin.fr, autosecuritas-ct-notre-dame-doe.fr, autosecuritas-passins.fr, autosecuritas-ctlp.fr, autosecuritas-tallard.fr, autosecuritaslemoule.fr, autosecuritas-ducos.fr, logos/autosecuritas-ct-seysses.fr.png, logos/autosecuritas-barlin.fr.png, logos/autosecuritas-ct-notre-dame-doe.fr.png, logos/autosecuritas-passins.fr.png, logos/autosecuritas-ctlp.fr.png, logos/autosecuritas-tallard.fr.png, logos/autosecuritaslemoule.fr.png, logos/autosecuritas-ducos.fr.png
Grup 3, ovb.ro, ovb.at, ovb.gr, logos/ovb.ro.png, logos/ovb.at.png, logos/ovb.gr.png
Grup 4, mazda-autohaus-hellwig-hoyerswerda.de, mazda-autohaus-kaschmieder-waren.de, mazda-autohaus-lackmann-sendenhorst.de, mazda-autohaus-roessel-birkenau.de, mazda-autohaus-wassing-ahaus-wuellen.de, mazda-autohaus-henseler-schwedt.de, mazda-autohaus-hansmann-kassel.de, mazda-autohaus-sturne-rochlitz.de, mazda-autohaus-blank-dinkelsbuehl.de, mazda-autohaus-becker-homburg-bruchhof.de, mazda-autohaus-sturne-grimma.de, mazda-autohaus-fenzl-hauzenberg.de, mazda-autohaus-tabbouch-speyer.de, mazda-autohaus-haese-erkrath-hochdahl.de, mazda-autohaus-kilger-regen.de, mazda-autohaus-banaszak-kleve.de, mazda-autohaus-elstner-jena.de, mazda-autohaus-dorner-riedlingen.de, mazda-service-koch-ludwigsfelde.de, mazda-autohaus-ludwig-halle-neustadt.de, mazda-autohaus-buelo-naumburg.de, mazda-autohaus-thoss-falkenstein.de, mazda-autohaus-lotspeich-muenchen.de, mazda-autohaus-fritsche-grossschoenau.de, mazda-autohaus-schindlbeck-straubing.de, mazda-autohaus-mueller-und-thurnes-tholey.de, mazda-autohaus-doerenkaemper-bad-hersfeld.de, mazda-autohaus-stiefel-muehlacker.de, mazda-autohaus-boehme-lutherstadt-wittenberg.de, mazda-autohaus-abs-erlangen.de, mazda-autohaus-wilhelm-huellhorst.de, mazda-autohaus-lehmann-senftenberg.de, mazda-autohaus-heider-dresden.de, mazda-autohaus-rausch-dresden.de, mazda-autohaus-voigtlaender-meyer-hamburg.de, mazda-automobile-weberpals-sonneberg-hoenbach.de, mazda-autohaus-hansmann-melsungen.de, mazda.com.ec, mazda-autohaus-schmidt-meschede.de, mazda-autohaus-weber-magdeburg.de, mazda-autocentrum-engin-holzminden.de, mazda-autohaus-kramer-kirchberg.de, mazda-autohaus-w-k-kamen.de, mazda-autohaus-tietje-holmb-wedel.de, mazda-autohaus-engelbart-delmenhorst.de, mazda-autohaus-gruendel-doerth.de, mazda-autohaus-wedding-engelskirchen-albertsth.de, mazda-autohaus-trumpf-wimmelburg.de, mazda-autohaus-lohmann-kreuztal.de, mazda-autohaus-tillack-perleberg.de, mazda-autohaus-misch-uebach-palenberg.de, mazda-autohaus-suedring-datteln.de, mazda-automobile-maier-cham.de, mazda-autohaus-hamester-hamburg-bergedorf.de, mazda-autohaus-ruettiger-wallduern.de, mazda-autohaus-bolluck-goslar.de, mazda-autohaus-wagner-dortmund.de, mazda-autohaus-berlenbach-bergischgladbach.de, mazda-autohaus-eisele-langenau.de, mazda-autohaus-witthoeft-bad-oldesloe.de, mazda-autohaus-roeser-grossmaischeid.de, mazda-autohaus-klein-bietigheim-bissingen.de, mazda-autohaus-bayer-goessweinstein.de, mazda-autohaus-ehrlich-aschaffenburg.de, mazda-autohaus-schmidt-oschatz.de, mazda-autohaus-gerhard-figge-waldeck-hoeringhausen.de, mazda-autohaus-schmidt-grossenhain.de, mazda-autohaus-dittrich-genthin-huettermuehle.de, mazda-autohaus-schneider-sondershausen.de, mazda-autohaus-rottmann-bottrop.de, mazda-autohaus-stoelzel-doehlau.de, mazda-autohaus-baumgart-altensteig.de, mazda-autohaus-kopke-bendel-marl.de, mazda-autohaus-haeusler-fuerstenfeldbruck.de, mazda-autohaus-albers-doerpen.de, mazda-service-metz-marne.de, mazda-autohaus-weiss-niedernhausen.de, mazda-autohaus-schindlbeck-schwandorf.de, mazda-autohaus-grasdanner-holzkirchen.de, mazda-autohaus-kalina-gelsenkirchen.de, mazda-autohaus-hoeffner-clausen.de, mazda-autohaus-goedde-meschede.de, mazda-autohaus-ahb-gotha.de, mazda-autohaus-friedmann-steinfeld.de, mazda-autohaus-gollan-hamm.de, mazda-autohaus-ubben-aurich.de, mazda-autohaus-torp-wilhelmshaven.de, mazda-autopark-rath-krefeld.de, mazda-autohaus-dohm-horn-bad-meinberg.de, mazda-autohaus-schreier-biebergemuend-bieber.de, mazda-autohaus-brutschin-lenzkirch.de, mazda-autohaus-mueller-plauen.de, mazda-autohaus-wilk-kaczmarek-schwerin.de, mazda-autohaus-schwenke-duisburg.de, mazda-autohaus-moellenkamp-rheine.de, mazda-autohaus-born-ludwigslust.de, mazda-autohaus-lommel-grettstadt.de, mazda-autohaus-richter-forst.de, mazda-autohaus-flindt-marschacht.de, mazda-autohaus-hohenfeld-dinslaken.de, mazda-autohaus-mork-rockenhausen.de, mazda-autohaus-wuttke-gummersbach.de, mazda-autohaus-behrens-magdeburg-ottersleben.de, mazda-autohaus-henn-weilamrhein.de, mazda-autohaus-banaszak-wesel.de, mazda-autohaus-huck-buehl.de, logos/mazda-autohaus-hellwig-hoyerswerda.de.png, logos/mazda-autohaus-kaschmieder-waren.de.png, logos/mazda-autohaus-lackmann-sendenhorst.de.png, logos/mazda-autohaus-roessel-birkenau.de.png, logos/mazda-autohaus-wassing-ahaus-wuellen.de.png, logos/mazda-autohaus-henseler-schwedt.de.png, logos/mazda-autohaus-hansmann-kassel.de.png, logos/mazda-autohaus-sturne-rochlitz.de.png, logos/mazda-autohaus-blank-dinkelsbuehl.de.png, logos/mazda-autohaus-becker-homburg-bruchhof.de.png, logos/mazda-autohaus-sturne-grimma.de.png, logos/mazda-autohaus-fenzl-hauzenberg.de.png, logos/mazda-autohaus-tabbouch-speyer.de.png, logos/mazda-autohaus-haese-erkrath-hochdahl.de.png, logos/mazda-autohaus-kilger-regen.de.png, logos/mazda-autohaus-banaszak-kleve.de.png, logos/mazda-autohaus-elstner-jena.de.png, logos/mazda-autohaus-dorner-riedlingen.de.png, logos/mazda-service-koch-ludwigsfelde.de.png, logos/mazda-autohaus-ludwig-halle-neustadt.de.png, logos/mazda-autohaus-buelo-naumburg.de.png, logos/mazda-autohaus-thoss-falkenstein.de.png, logos/mazda-autohaus-lotspeich-muenchen.de.png, logos/mazda-autohaus-fritsche-grossschoenau.de.png, logos/mazda-autohaus-schindlbeck-straubing.de.png, logos/mazda-autohaus-mueller-und-thurnes-tholey.de.png, logos/mazda-autohaus-doerenkaemper-bad-hersfeld.de.png, logos/mazda-autohaus-stiefel-muehlacker.de.png, logos/mazda-autohaus-boehme-lutherstadt-wittenberg.de.png, logos/mazda-autohaus-abs-erlangen.de.png, logos/mazda-autohaus-wilhelm-huellhorst.de.png, logos/mazda-autohaus-lehmann-senftenberg.de.png, logos/mazda-autohaus-heider-dresden.de.png, logos/mazda-autohaus-rausch-dresden.de.png, logos/mazda-autohaus-voigtlaender-meyer-hamburg.de.png, logos/mazda-automobile-weberpals-sonneberg-hoenbach.de.png, logos/mazda-autohaus-hansmann-melsungen.de.png, logos/mazda.com.ec.png, logos/mazda-autohaus-schmidt-meschede.de.png, logos/mazda-autohaus-weber-magdeburg.de.png, logos/mazda-autocentrum-engin-holzminden.de.png, logos/mazda-autohaus-kramer-kirchberg.de.png, logos/mazda-autohaus-w-k-kamen.de.png, logos/mazda-autohaus-tietje-holmb-wedel.de.png, logos/mazda-autohaus-engelbart-delmenhorst.de.png, logos/mazda-autohaus-gruendel-doerth.de.png, logos/mazda-autohaus-wedding-engelskirchen-albertsth.de.png, logos/mazda-autohaus-trumpf-wimmelburg.de.png, logos/mazda-autohaus-lohmann-kreuztal.de.png, logos/mazda-autohaus-tillack-perleberg.de.png, logos/mazda-autohaus-misch-uebach-palenberg.de.png, logos/mazda-autohaus-suedring-datteln.de.png, logos/mazda-automobile-maier-cham.de.png, logos/mazda-autohaus-hamester-hamburg-bergedorf.de.png, logos/mazda-autohaus-ruettiger-wallduern.de.png, logos/mazda-autohaus-bolluck-goslar.de.png, logos/mazda-autohaus-wagner-dortmund.de.png, logos/mazda-autohaus-berlenbach-bergischgladbach.de.png, logos/mazda-autohaus-eisele-langenau.de.png, logos/mazda-autohaus-witthoeft-bad-oldesloe.de.png, logos/mazda-autohaus-roeser-grossmaischeid.de.png, logos/mazda-autohaus-klein-bietigheim-bissingen.de.png, logos/mazda-autohaus-bayer-goessweinstein.de.png, logos/mazda-autohaus-ehrlich-aschaffenburg.de.png, logos/mazda-autohaus-schmidt-oschatz.de.png, logos/mazda-autohaus-gerhard-figge-waldeck-hoeringhausen.de.png, logos/mazda-autohaus-schmidt-grossenhain.de.png, logos/mazda-autohaus-dittrich-genthin-huettermuehle.de.png, logos/mazda-autohaus-schneider-sondershausen.de.png, logos/mazda-autohaus-rottmann-bottrop.de.png, logos/mazda-autohaus-stoelzel-doehlau.de.png, logos/mazda-autohaus-baumgart-altensteig.de.png, logos/mazda-autohaus-kopke-bendel-marl.de.png, logos/mazda-autohaus-haeusler-fuerstenfeldbruck.de.png, logos/mazda-autohaus-albers-doerpen.de.png, logos/mazda-service-metz-marne.de.png, logos/mazda-autohaus-weiss-niedernhausen.de.png, logos/mazda-autohaus-schindlbeck-schwandorf.de.png, logos/mazda-autohaus-grasdanner-holzkirchen.de.png, logos/mazda-autohaus-kalina-gelsenkirchen.de.png, logos/mazda-autohaus-hoeffner-clausen.de.png, logos/mazda-autohaus-goedde-meschede.de.png, logos/mazda-autohaus-ahb-gotha.de.png, logos/mazda-autohaus-friedmann-steinfeld.de.png, logos/mazda-autohaus-gollan-hamm.de.png, logos/mazda-autohaus-ubben-aurich.de.png, logos/mazda-autohaus-torp-wilhelmshaven.de.png, logos/mazda-autopark-rath-krefeld.de.png, logos/mazda-autohaus-dohm-horn-bad-meinberg.de.png, logos/mazda-autohaus-schreier-biebergemuend-bieber.de.png, logos/mazda-autohaus-brutschin-lenzkirch.de.png, logos/mazda-autohaus-mueller-plauen.de.png, logos/mazda-autohaus-wilk-kaczmarek-schwerin.de.png, logos/mazda-autohaus-schwenke-duisburg.de.png, logos/mazda-autohaus-moellenkamp-rheine.de.png, logos/mazda-autohaus-born-ludwigslust.de.png, logos/mazda-autohaus-lommel-grettstadt.de.png, logos/mazda-autohaus-richter-forst.de.png, logos/mazda-autohaus-flindt-marschacht.de.png, logos/mazda-autohaus-hohenfeld-dinslaken.de.png, logos/mazda-autohaus-mork-rockenhausen.de.png, logos/mazda-autohaus-wuttke-gummersbach.de.png, logos/mazda-autohaus-behrens-magdeburg-ottersleben.de.png, logos/mazda-autohaus-henn-weilamrhein.de.png, logos/mazda-autohaus-banaszak-wesel.de.png, logos/mazda-autohaus-huck-buehl.de.png
Grup 5, toyota-buchreiter-eisenstadt.at, toyota-bauer.at, toyota.com.kh, toyota-ulrichshofer.at, toyota-niederberger.at, toyota-innviertel.at, toyota-handler.at, toyota.com.la, toyota.com.np, logos/toyota-buchreiter-eisenstadt.at.png, logos/toyota-bauer.at.png, logos/toyota.com.kh.png, logos/toyota-ulrichshofer.at.png, logos/toyota-niederberger.at.png, logos/toyota-innviertel.at.png, logos/toyota-handler.at.png, logos/toyota.com.la.png, logos/toyota.com.np.png
Grup 6, ebay.cn, logos/ebay.cn.png
Grup 7, greatplacetowork.com.bo, greatplacetowork.se, greatplacetowork.com.ar, greatplacetowork.com.tr, greatplacetowork.ch, greatplacetowork.fr, greatplacetowork.com.uy, greatplacetowork.is, greatplacetowork.at, logos/greatplacetowork.com.bo.png, logos/greatplacetowork.se.png, logos/greatplacetowork.com.ar.png, logos/greatplacetowork.com.tr.png, logos/greatplacetowork.ch.png, logos/greatplacetowork.fr.png, logos/greatplacetowork.com.uy.png, logos/greatplacetowork.is.png, logos/greatplacetowork.at.png
Grup 8, wurth-international.com, wurth-international.com.cn, wurth.fi, wuerthmarket.ru, wuerth.co.jp, wurth-int.com, wuerth-ag.ch, wuerth-gruppe.ch, wurth.com.tw, wuerth.com.kh, wuerth.dk, wurth.nl, logos/wurth-international.com.png, logos/wurth-international.com.cn.png, logos/wurth.fi.png, logos/wuerthmarket.ru.png, logos/wuerth.co.jp.png, logos/wurth-int.com.png, logos/wuerth-ag.ch.png, logos/wuerth-gruppe.ch.png, logos/wurth.com.tw.png, logos/wuerth.com.kh.png, logos/wuerth.dk.png, logos/wurth.nl.png
Grup 9, plameco-hannover.de, logos/plameco-hannover.de.png
Grup 10, kia-moeller-wunstorf.de, kia-suedmobile-radolfzell.de, kia-gorny-eislingen.de, kia-moeller-eisenach.de, kia-mueller-genthin.de, kia-plt.ru, kia-crimea.ru, kia-kmv.ru, kia-chita.ru, kia-hotz-gardelegen.de, kia-christ-ansbach.de, kia-strehle-dresden.de, kia-asc.ru, kia-bachmann-wehretal.de, kia-brass-frankfurt.de, kia-gj-remagen-rolandseck.de, kia-diamant-wiesbaden.de, kia-kurt-recklinghausen.de, kia.com.np, kia-penning-zetelneuenburg.de, kia-koenig-teltow.de, kia-vogt-finningen.de, kia-daehn-goeritz.de, kia-schmid-hoehenkirchen.de, kia-fischer-cottbus.de, kia-schunke-aurich.de, kia-kroppen-herten.de, kia-bender-coburg.de, kia-brueggemann-neubrandenburg.de, kia-settele-neu-ulm.de, kia-ds-lampertheim.de, kia-telke-badschlema.de, kia-levy-wittenberg.de, kia-dresen-neuss.de, kia-ebner-baienfurt.de, kia-guadeloupe.com, kia-ahs-roehrnbach.de, kia-etehad-halstenbek.de, kia-hoff-trier.de, kia-burian-celle.de, kia-brueggemann-brandenburg.de, kia.pt, kia-exner.de, kia-fugel-dresden.de, kia-jaeger-bevern.de, kia-maier-cham.de, kia.co.mz, kia-sauter-albstadt.de, kia-auto-center-weiterstadt.de, kia-trinkle-schorndorf.de, kia-beyschlag.at, kia-duerkop-hannover.de, kia-guenther-dingelstaedt.de, kia-autoprodix.ru, kia-car-center-wismar.de, kia-wandscher-oldenburg.de, kia-h-p-schiffweiler.de, kia-engbert-datteln.de, kia-lange-gosen.de, kia-fischer-muenchberg.de, kia-poeschl-bensheim.de, logos/kia-moeller-wunstorf.de.png, logos/kia-suedmobile-radolfzell.de.png, logos/kia-gorny-eislingen.de.png, logos/kia-moeller-eisenach.de.png, logos/kia-mueller-genthin.de.png, logos/kia-plt.ru.png, logos/kia-crimea.ru.png, logos/kia-kmv.ru.png, logos/kia-chita.ru.png, logos/kia-hotz-gardelegen.de.png, logos/kia-christ-ansbach.de.png, logos/kia-strehle-dresden.de.png, logos/kia-asc.ru.png, logos/kia-bachmann-wehretal.de.png, logos/kia-brass-frankfurt.de.png, logos/kia-gj-remagen-rolandseck.de.png, logos/kia-diamant-wiesbaden.de.png, logos/kia-kurt-recklinghausen.de.png, logos/kia.com.np.png, logos/kia-penning-zetelneuenburg.de.png, logos/kia-koenig-teltow.de.png, logos/kia-vogt-finningen.de.png, logos/kia-daehn-goeritz.de.png, logos/kia-schmid-hoehenkirchen.de.png, logos/kia-fischer-cottbus.de.png, logos/kia-schunke-aurich.de.png, logos/kia-kroppen-herten.de.png, logos/kia-bender-coburg.de.png, logos/kia-brueggemann-neubrandenburg.de.png, logos/kia-settele-neu-ulm.de.png, logos/kia-ds-lampertheim.de.png, logos/kia-telke-badschlema.de.png, logos/kia-levy-wittenberg.de.png, logos/kia-dresen-neuss.de.png, logos/kia-ebner-baienfurt.de.png, logos/kia-guadeloupe.com.png, logos/kia-ahs-roehrnbach.de.png, logos/kia-etehad-halstenbek.de.png, logos/kia-hoff-trier.de.png, logos/kia-burian-celle.de.png, logos/kia-brueggemann-brandenburg.de.png, logos/kia.pt.png, logos/kia-exner.de.png, logos/kia-fugel-dresden.de.png, logos/kia-jaeger-bevern.de.png, logos/kia-maier-cham.de.png, logos/kia.co.mz.png, logos/kia-sauter-albstadt.de.png, logos/kia-auto-center-weiterstadt.de.png, logos/kia-trinkle-schorndorf.de.png, logos/kia-beyschlag.at.png, logos/kia-duerkop-hannover.de.png, logos/kia-guenther-dingelstaedt.de.png, logos/kia-autoprodix.ru.png, logos/kia-car-center-wismar.de.png, logos/kia-wandscher-oldenburg.de.png, logos/kia-h-p-schiffweiler.de.png, logos/kia-engbert-datteln.de.png, logos/kia-lange-gosen.de.png, logos/kia-fischer-muenchberg.de.png, logos/kia-poeschl-bensheim.de.png
Grup 11, ccusa.co.nz, ccusa.com.au, ccusa.hu, ccusa.ca, ccusa.cz, ccusa.nl, ccusa.co.uk, ccusa.sk, ccusa.co.za, logos/ccusa.co.nz.png, logos/ccusa.com.au.png, logos/ccusa.hu.png, logos/ccusa.ca.png, logos/ccusa.cz.png, logos/ccusa.nl.png, logos/ccusa.co.uk.png, logos/ccusa.sk.png, logos/ccusa.co.za.png
Grup 12, tupperware.at, tupperware.es, tupperware.be, tupperware.fr, tupperware.it, tupperware.pl, logos/tupperware.at.png, logos/tupperware.es.png, logos/tupperware.be.png, logos/tupperware.fr.png, logos/tupperware.it.png, logos/tupperware.pl.png
Grup 13, zalando.cz, zalando.dk, zalando.no, zalando.at, zalando.be, zalando.ee, zalando.pl, zalando.ch, zalando.nl, zalando.co.uk, logos/zalando.cz.png, logos/zalando.dk.png, logos/zalando.no.png, logos/zalando.at.png, logos/zalando.be.png, logos/zalando.ee.png, logos/zalando.pl.png, logos/zalando.ch.png, logos/zalando.nl.png, logos/zalando.co.uk.png
Grup 14, crocs.com.uy, crocs.com.ec, logos/crocs.com.uy.png, logos/crocs.com.ec.png
Grup 15, ymcasteuben.org, logos/ymcasteuben.org.png
Grup 16, engie.co.uk, engieresources.com, engie.nl, logos/engie.co.uk.png, logos/engieresources.com.png, logos/engie.nl.png
Grup 17, ibc-solar.jp, ibc-solar.pl, ibc-solar.es, ibc-solar.cz, ibc-solar.it, ibc-solar.co.za, ibc-solar.nl, logos/ibc-solar.jp.png, logos/ibc-solar.pl.png, logos/ibc-solar.es.png, logos/ibc-solar.cz.png, logos/ibc-solar.it.png, logos/ibc-solar.co.za.png, logos/ibc-solar.nl.png
Grup 18, lidl.com.cy, lidl.lt, lidl-ni.co.uk, lidl-immobilien.de, lidl-voyages.fr, lidl.lv, lidl.lu, lidl.ee, logos/lidl.com.cy.png, logos/lidl.lt.png, logos/lidl-ni.co.uk.png, logos/lidl-immobilien.de.png, logos/lidl-voyages.fr.png, logos/lidl.lv.png, logos/lidl.lu.png, logos/lidl.ee.png
Grup 19, nobleprog.mx, nobleprog.co.th, nobleprog.ro, nobleprog.es, nobleprog.com.eg, nobleprog.ae, nobleprog.com.ar, nobleprog.com.ng, logos/nobleprog.mx.png, logos/nobleprog.co.th.png, logos/nobleprog.ro.png, logos/nobleprog.es.png, logos/nobleprog.com.eg.png, logos/nobleprog.ae.png, logos/nobleprog.com.ar.png, logos/nobleprog.com.ng.png
Grup 20, freseniusmedicalcare.ca, logos/freseniusmedicalcare.ca.png
Grup 21, synlab.com.tr, synlab.com.gh, synlab.hr, synlab.si, synlab.com.cy, synlab.lt, synlab.mk, synlab.by, logos/synlab.com.tr.png, logos/synlab.com.gh.png, logos/synlab.hr.png, logos/synlab.si.png, logos/synlab.com.cy.png, logos/synlab.lt.png, logos/synlab.mk.png, logos/synlab.by.png
Grup 22, avis.cr, logos/avis.cr.png
Grup 23, ebayglobalshipping.com, ebay.co.kr, logos/ebayglobalshipping.com.png, logos/ebay.co.kr.png
Grup 24, cafelasmargaritas.es, logos/cafelasmargaritas.es.png
Grup 25, affidea.ba, affidea.pt, affidea.pl, affidea.ro, logos/affidea.ba.png, logos/affidea.pt.png, logos/affidea.pl.png, logos/affidea.ro.png
Grup 26, bakertilly.lu, bakertilly.es, bakertilly.ci, bakertilly.ky, bakertilly.dk, bakertilly.lv, bakertilly.sg, bakertilly.sl, bakertilly.gt, bakertilly.fr, bakertilly.se, bakertilly.it, bakertilly.no, bakertillyeg.com, bakertilly.ma, bakertilly.vg, bakertilly.ng, bakertilly.mu, bakertilly.pt, bakertillygh.com, bakertilly.gi, bakertilly.com.jm, logos/bakertilly.lu.png, logos/bakertilly.es.png, logos/bakertilly.ci.png, logos/bakertilly.ky.png, logos/bakertilly.dk.png, logos/bakertilly.lv.png, logos/bakertilly.sg.png, logos/bakertilly.sl.png, logos/bakertilly.gt.png, logos/bakertilly.fr.png, logos/bakertilly.se.png, logos/bakertilly.it.png, logos/bakertilly.no.png, logos/bakertillyeg.com.png, logos/bakertilly.ma.png, logos/bakertilly.vg.png, logos/bakertilly.ng.png, logos/bakertilly.mu.png, logos/bakertilly.pt.png, logos/bakertillygh.com.png, logos/bakertilly.gi.png, logos/bakertilly.com.jm.png
Grup 27, spitex-wasseramt.ch, spitex-region-stockhorn.ch, spitexgaiserwald.ch, spitex-hoefe.ch, spitexstaefa.ch, spitex-region-zofingen.ch, spitex-flawil-degersheim.ch, spitexbuchs.ch, spitexlauchetal.ch, spitex-regiokirchspiel.ch, spitex-meggen.ch, spitex-see-lac.ch, spitex-steinmaur-neerach.ch, spitex-freiamt.ch, spitex-trevalli.ch, spitex-region-kreuzlingen.ch, spitex-appenzellerland.ch, spitex-rothenburg.ch, spitex-muellheim.ch, spitex-gersau.ch, spitexampuls.ch, spitexgraenichen.ch, spitexsense.ch, spitex-aarenord.ch, logos/spitex-wasseramt.ch.png, logos/spitex-region-stockhorn.ch.png, logos/spitexgaiserwald.ch.png, logos/spitex-hoefe.ch.png, logos/spitexstaefa.ch.png, logos/spitex-region-zofingen.ch.png, logos/spitex-flawil-degersheim.ch.png, logos/spitexbuchs.ch.png, logos/spitexlauchetal.ch.png, logos/spitex-regiokirchspiel.ch.png, logos/spitex-meggen.ch.png, logos/spitex-see-lac.ch.png, logos/spitex-steinmaur-neerach.ch.png, logos/spitex-freiamt.ch.png, logos/spitex-trevalli.ch.png, logos/spitex-region-kreuzlingen.ch.png, logos/spitex-appenzellerland.ch.png, logos/spitex-rothenburg.ch.png, logos/spitex-muellheim.ch.png, logos/spitex-gersau.ch.png, logos/spitexampuls.ch.png, logos/spitexgraenichen.ch.png, logos/spitexsense.ch.png, logos/spitex-aarenord.ch.png
